{
  "id": "hans-edelsberg",
  "icon": "📊",
  "name": "Hans Edelsberg",
  "role": "Coord. Técnica · Data engineering",
  "capabilities": [
    {
      "text": "<strong>Expertise en data engineering</strong> y arquitectura de datos institucional",
      "needsIds": [
        3
      ]
    },
    {
      "text": "<strong>Visión de APIs abiertas</strong> para estandarización entre cuerpos de bomberos",
      "needsIds": [
        3,
        4
      ]
    },
    {
      "text": "<strong>Criterio de realismo técnico</strong>: distingue IA viable de aspiracional",
      "needsIds": [
        4
      ]
    },
    {
      "text": "<strong>Comprensión de cambio cultural</strong> en voluntarios operativos",
      "needsIds": [
        2
      ]
    }
  ],
  "unique": "Hans plantea la pregunta más incómoda y más necesaria: ¿hay datos para hacer IA o estamos jugando?",
  "needsCount": 3,
  "status_action": true
}